id,keyword,location,text,target
2736,crushed,,crushed km run pace nike sportwatch gps nikeplus,0
2739,crushed,United States,nick williams just hit another bomb just crushed,0
2740,crushed,,holy moly crushed,1
2741,crushed,,ayekoradio play brasswork agency crushed shaken radio netlabel electronicmusic listen ccmusic,0
2743,crushed,,many youtube commenters saying dothraki get crushed came westerosnah bro underestimate dothraki,1
2744,crushed,Trinidad and Tobago,disillusioned lead character check happy go lucky free spirit girl check dream life crushed check great music check crowe tropes intact,0
2748,crushed,South Sudan,remember nora jones crushed two weeks notice,0
2749,crushed,Canada,empire avenue crushed soul via,0
2752,crushed,South Sudan,m chapoutier crozes hermitage purple violets slate crushed gravel white pepper yum france wine dc,0
2753,curfew,,thirst curfew,0
2755,curfew,Türkiye,ara news reporting jan fighters infiltrated ashrafiyah district afrin aim carrying suicide attacks ypg imposed curfew,1
2756,curfew,,thirst curfew,0
2757,curfew,,fact curfew,0
2758,curfew,United States,shut up freshman past ur curfew u need sleep u spend ur time watching tv going outside,0
2759,curfew,United States,night curfew campus find here,0
2760,curfew,Israel,police teenagers arrested curfew violations evanston riding stolen bicycles two teenagers taken cus chicago news,1
2761,curfew,,reason listening curfew overtime stuck kodak again,0
2763,curfew,India,shouldve gave curfew,0
2765,curfew,Isle of Man,curfew really helps think bc,0
2766,curfew,Bahamas,exofficio mens boxer brief curfew large,0
2767,curfew,Australia,info s wnd cld sct bkn exp inst apch rwy curfew oper z taxiways foxtrot foxtrot navbl tmp,0
2768,curfew,,thank you city wide curfew,0
2769,curfew,,just curfew nope,0
2770,curfew,,curfew start right private class ends tutor woman preferably someone,0
2771,curfew,,curfew,0
2773,curfew,,past curfew grove,0
2774,curfew,United States,oclock mom everyone go home curfew,1
2777,curfew,Estonia,few months get curfew time smfh,0
2778,curfew,,ball curfew,0
2780,curfew,,seen turn blind eye bloke drinking smoking curfew time cosits worth hassle,1
2782,curfew,,next freefrom school obligations like family best damn curfew,1
2783,curfew,Uganda,know saying final goodbyes grandpa seen news rip me always open ideas ve curfew,0
2784,curfew,,people really still curfew even theyre graduated high school,0
2785,curfew,,telling mom up past curfew oth,0
2786,curfew,India,cancel cats doctor appointment decided go play come home curfew,0
2787,curfew,Australia,info r curfew oper z taxiways foxtrot foxtrot navbl wnd exp inst apch rwy damp tmp qnh,0
2788,curfew,United States,lies though pays oldest sometimes like first get car curfew freedom donthate,0
2792,curfew,Australia,info u cld sct bkn exp inst apch rwy curfew oper z taxiways foxtrot foxtrot navbl tmp wnd,0
2793,curfew,Cambodia,rite man tlk widout nuh curfew long side aka cum fi steal di show itz rubbery di whole dem fi knw sound music,0
2794,curfew,,even come worried curfew bc,0
2795,curfew,,got whole curfew,0
2796,curfew,,hours late curfew pray dog bark unlocking door,0
2797,curfew,Isle of Man,da judge gave dis girl pm curfew,0
2799,curfew,,beginning summer mom made curfew back never go wonders why always home,0
2801,curfew,,why charlie lim start pm sunday curfew leh,0
2802,curfew,United Kingdom,u bombed u try get home curfew,0
2803,cyclone,United States,awwww baby walter rewatchingthepilot teamscorpion cyclone,0
2807,cyclone,Rwanda,the big ten annual football media day get heres cyclone hoops recruiting nuggets,1
2808,cyclone,United States,camera art photography new boltåêcyclone dr ppdr dual outlet power packåêfor external camera flash,0
2811,cyclone,Burundi,works purpose large cyclone better just k,0
2813,cyclone,Russian Federation,new tropical cyclone forming near guam once formed called molave,1
2815,cyclone,,video new de jhaustin thomas cyclone ames tribune ames tribune video new de jhaustin thomas,0
2817,cyclone,,need plants pacific cyclone seasons help,1
2819,cyclone,,bbc forced retract false claims cyclone pam via,1
2820,cyclone,,great condition easton cyclone softball bat fastpitch sk,1
2821,cyclone,Philippines,severe weather bulletin no for typhoon soudelor tropical cyclone warning issued pm,1
2822,cyclone,United States,the cyclone derives powers calm center person norman vincent peale,1
2825,cyclone,,ante hudhud cyclone chandrababu valle ne ante ga,1
2826,cyclone,Syrian Arab Republic,cyclone komen devastates families myanmar week need help today,1
2827,cyclone,Philippines,severe weather bulletin tropical cyclone warning typhoon hanna issued pm thursday august,1
2828,cyclone,,back future vanuatu cyclone pam encouraged traditional ways living,1
2829,cyclone,United States,bank manager asks tom interview what cyclone tom it loan purchase bicycle,0
2830,cyclone,Sudan,excited cyclone football,0
2831,cyclone,United Kingdom,bbc forced retract false claims cyclone pam via,1
2832,cyclone,,talent misdirection cyclone pass ignite pass vanishing drive phantom shot kurokobot,1
2833,cyclone,Czechia,comdev asia radio stations bangladesh broadcasting programs to address upcoming cyclone komen,1
2835,cyclone,,like cyclone imperialism spins globe militarism crushes peoples sucks blood like a,1
2836,cyclone,,mercury cyclone gt hood moulding nice core cobra jet cj gt,0
2838,cyclone,,im cyclone passion overblown,0
2839,cyclone,,majesty emperor salman khans unstoppable cyclone entertainment humanity bajrangi bhaijaan creating history everywhere crosed cr,0
2841,cyclone,,mercury cyclone gt quarter panel ds rear trim moulding cobra jet cj,1
2842,cyclone,,tropical cyclone info soudelor hpa maximum wind speed ms maximum wind gust speed ms,1
2843,cyclone,,ask cyclonesama read jailed fate rindou,0
2844,cyclone,Lithuania,drugs alcohol jackson vroman house,0
2846,cyclone,,blending old new vanuatu prepare future emergencies,0
2849,cyclone,,wfp wfp delivers food bangladesh flood victims tropical cyclone komen dhaka united na,1
2851,cyclone,,rohingya houses kyee nockthie hamlet taungbazar region buthidaung severely damaged cyclone,1
2852,cyclone,Portugal,cyclone double g cherry top outfit ootd doubleghats,0
2853,damage,"Palestine, State of",theyll probably allow ascend get damage max values,0
2854,damage,,drop down nigga damage,0
2855,damage,United Kingdom,unions say supportive london yet prepared damage economically åm last time,0
2856,damage,United States,liked video gta online collateral damage gta v online pc,0
2857,damage,Kenya,fyi accident property damage limestone lncolyellowstone wayfieldstone dr,1
2858,damage,United States,fitness knee damage solution,0
2860,damage,Malaysia,complaining phoenix mode fire emblem turns ray gigant difficulty option take damage,0
2861,damage,,wha t kids damage,0
2863,damage,,cleared accident property damage ny eb ny,1
2864,damage,,crazy phone damage person,0
2865,damage,Canada,got pretty windy too damage,0
2866,damage,,reusing advanced life equipments transit drumming champaign damage fdbdp,0
2867,damage,United Kingdom,carful spotting damage time check why time giving away baggage loss d wy,0
2869,damage,United States,storm damage reported west tennessee,1
2870,damage,Malta,hey royals love damage outs,1
2871,damage,,keep please arachys pieces deals weapon damage up,1
2872,damage,Indonesia,mages fairy tail specialize property damage natsu dragneel,0
2873,damage,,yeah fast extremely high damage fast gonna get u the,1
2875,damage,,saw fast af great damage upgraded shitton exclusively whole playthrough,0
2877,damage,Philippines,say tree falls fence know homeowners insurance help,0
2878,damage,New Caledonia,tor tor situation only wind damage enhanced wording key imo,1
2879,damage,,happening hear runway lighting damage contractor,1
2880,damage,Dominican Republic,nda written damage ability offer services future prolly work anyway,0
2881,damage,,trillion crosses line rd time fieldwide attack instant kill damage,1
2882,damage,Spain,np metallica damage inc,0
2883,damage,India,nine inmates charged causing damage calgary remand centre riot,1
2884,damage,United Kingdom,pt crosssectarian protest powerful shia cleric militias withdrawur fightin isis wont forget damage uve ur ppl,1
2885,damage,Thailand,homeowners insurance cover water damage good things know,1
2886,damage,,beach damage shit,1
2887,damage,,crosses arms cover hands anymore damage hhello,0
2888,damage,,new post blog thesensualeye model cam damage toronto apr nsfw pussy ass boobs asian nude,0
2889,damage,Saint Vincent and the Grenadines,reported hit runin roadwayproperty damage statesville rd,1
2890,damage,,devil cry special edition vergil vs agnus window mission dmd damage leedstraif,0
2891,damage,Liberia,glaucoma occurs fluid builds up pressure inside eye level damage optic nerve eyefacts,1
2893,damage,,jsunnews storm damage reported madison county thunderstorm damage reports ar via,1
2895,damage,,sa puncture wound foreign body left index finger damage nail initial encounter icd,1
2896,damage,Australia,thank words warning re queenswharf brisbane via,0
2898,damage,,real shit damage bitch,0
2899,damage,,lmao fuckboy changed damage control,0
2900,damage,India,standard damage control,1
2902,damage,United States,superficial wounds pepper spray damage,1
2905,danger,,dad chase constantly time frequently great deal danger distraction,0
2907,danger,,believe shirt company every animal ever danger better start seeing changes wildlife,0
2908,danger,Lebanon,danger union bears,0
2909,danger,,signup open falling danger release day blast review tour signup here,1
2910,danger,,check rockin preview danger zone coming soon artistsunited,0
2911,danger,Dominican Republic,red flag warning fire danger dry thunderstorms bay area weather cawx,1
2912,danger,,check rockin preview danger zone coming soon artistsunited,0
2913,danger,United Kingdom,this like danger something,1
2915,danger,,last tree cut down last fish eaten last stream poisoned realize you,0
2916,danger,Kenya,take away preservation parks r imposition danger african people never imagined,0
2917,danger,,indian govt media take serious concern safety danger now,1
2920,danger,Sao Tome and Principe,training grains wheat bare gold august heat anger trespass lest seek danger,0
2921,danger,Georgia,fettilootch slanglucci oppressions greatest danger coming soon album,0
2922,danger,,appears govt lost ethical moral relevance means whole usa population danger them,0
2924,danger,United Kingdom,like head first slides especially home danger,0
2925,danger,,permits bear hunting danger outnumbering actual bears licenses floridas fir st petersburg,0
2927,danger,France,and danger please,0
2929,danger,Georgia,fettilootch slanglucci oppressions greatest danger coming soon album,1
2931,danger,Morocco,looking repair recent bad rap nonprofit partnerships,0
2932,danger,,wish get victorias secret front good it,0
2933,danger,,check rockin preview danger zone coming soon artistsunited,0
2934,danger,United Kingdom,why arsenal fans that west ham relegation battle season danger afc sun,0
2935,danger,Georgia,fettilootch slanglucci oppressions greatest danger coming soon album,0
2936,danger,Georgia,fettilootch slanglucci oppressions greatest danger coming soon album,0
2937,danger,,danger excitement underwater cave diving,0
2939,danger,,girl wanna save like danger health try somebody wanna somebody else,0
2941,danger,,guns protection shit really shouldnt unless life danger,0
2942,danger,,thirsty yall danger dehydration,1
2943,danger,Dominican Republic,thunderstorms little rain expected central california high fire danger weather cawx,1
2944,danger,,wanna get danger days tattoo bad cool spider look like someones wrist smth,0
2945,danger,Israel,experience always angry critical pundit grave danger going off rails,0
2946,danger,Uruguay,danger skyler danger,0
2947,danger,United States,dangerous them ok rest danger,0
2948,danger,"Moldova, Republic of",investigate why robert mueller respond complaints nov just left meson danger,0
2950,danger,Jersey,honestly tho modibo maiga stealing living fuck past best still danger fucktard coyi,1
2952,danger,,fear way making danger none contemplating logic behind situation find courage engage,0
2953,dead,,joel book acts,0
2954,dead,Afghanistan,dead afghanistan aircraft crashes afghan military helicopter crashed remote region s,1
2955,dead,Sweden,why even awesome norse landscapes loads atmosphere life boringdead snotgreen wastelands,0
2956,dead,,miss longer hairbut dead anyways even hair,0
2957,dead,,sake argsuppose preborn attained individl rightsgenerally courtof law forbids killing unless dead person something,0
2959,dead,United Kingdom,remember time goku gave life dead birb hell goku,0
2960,dead,Iceland,naaa bee dead like legit zombie feel every sore part body,0
2963,dead,,just happened get same road right behind buses dead serious,0
2965,dead,,lmfao fucking luis hhahaha dead,0
2969,dead,,just watched emmerdale nd know slightly attractive man named ross just got beat up nd hes dead,1
2970,dead,United Kingdom,need confirm ross dead cause trust anyone else yh,0
2971,dead,,iwasdisappointedby telltales walking dead good characters story real gameplay many performance issues,0
2973,dead,,beforeitsnews hundreds feared dead libyan migrant boat capsizes rescue,1
2974,dead,India,war came never waved white flag front me end up dead wont misled,0
2975,dead,Cameroon,oh fuck sake dead,0
2976,dead,Ireland,ross really dead askcharley,0
2980,dead,,don avoid wearing dead black flaming red stark white esp debate go blue gold brown even shoes,0
2982,dead,,perspectives grateful dead critical writings contributions study,1
2983,dead,Thailand,hello looking mod cold ice saw site link download dead maybe share me thanks,0
2984,dead,,lmaovv hard ny new trend babalmaowelcome nyozi kwaaaaadead,0
2987,dead,Cameroon,hes dead else dies,0
2988,dead,United Kingdom,ross dead noooooooooooo,0
2990,dead,Estonia,thinking time friend bailed nite b dead showwent alone great time alone free dance front row,0
2991,dead,United States,typhoon soudelor taking dead aim taiwan,1
2992,dead,,askcharley emmerdale emotional ross dead,0
2993,dead,,man found dead demi moores swimming pool,1
2995,dead,Uganda,thats val dead suing,1
2998,dead,,dead,0
3000,dead,United States,wyrmwood road dead fucking awesome awesome ending too awesome one,0
3001,dead,United Kingdom,believe ross dead emmerdale summerfate,0
3003,death,,call text niggas bff boyfriend love boys death niggas hold attention like,0
3004,death,,hate talking otp grandma mean love death talk damn ssshhheeesshh,0
3005,death,,death forever rep jets,1
3006,death,,vibrator shaped vape busted,0
3009,death,"Taiwan, Province of China",death threats nigga life well gon,0
3010,death,Montenegro,adult dies plague colorado,1
3011,death,New Caledonia,xbox pro console red ring death full read ebay,0
3012,death,Argentina,going back gainesville death,1
3013,death,United Kingdom,year later ferguson sees change asks real,0
3014,death,,papiichampoo enjoy obama era civility prez gop supports iranian death,0
3015,death,,feel like death,0
3016,death,Eritrea,liked video dj hazard death sport,0
3018,death,,tell cousins wanna hang text saying were coming over honestly death wish,0
3019,death,,rss judge orders texas recognize spouse samesex death certificate,0
3021,death,,loyalty mission involves kicking shitty nobleman death love elven weirdo,0
3022,death,United Kingdom,way seemeth right unto man end thereof ways death,1
3023,death,,thanks narrowly averted death fun right,1
3025,death,,katherines death,0
3026,death,United States,death muslims,1
3027,death,,going starve death,0
3029,death,,ted cruz bashes obama comparison gop iranians shouting death america,0
3030,death,,katherines death,0
3034,death,,new crime knowing rights punishable death,0
3036,death,United States,issues uploading death smoochy awakenings clips reason bicentennial man pain ass,0
3037,death,Tonga,ted cruz bashes obama comparison gop iranians shouting death america tcot,1
3038,death,Cyprus,cyprus news analysis mullah omars death split talibans ranks omars demise certainly lead,1
3039,death,United States,feel like deathholy molys,0
3042,death,Chile,video slain mexican journalist unknowingly predicted own death via,0
3043,death,Jamaica,old lady rockin death metal sedan downtown smoking cigarette found real mom,0
3044,death,United Kingdom,afghan peace talks doubt mullah omars death financial times mullah,0
3045,death,Bulgaria,yall pusssssssssy shoook death,0
3047,death,New Caledonia,first trial death cecilthelion just postponed,0
3048,death,,years ago week anniversary marilyn monroes death ripriprip,0
3049,death,United Kingdom,aris hints snippets death me,0
3051,death,,tomorrow death,0
3052,death,Spain,new nyc legionnaires disease death toll rises follow,1
3053,deaths,,vaxshill deaths measles complications yrs everyone looses shit dead legionnaires month crickets,1
3054,deaths,,bigamist wife charged deaths pregnant wife child mother nephew,0
3055,deaths,New Caledonia,get i south huge wreck airlift maybe deaths interstate completely blocked,1
3056,deaths,United States,cases voter fraud year need new laws gun deaths day actually follows laws amirite,1
3057,deaths,Italy,silence palermo shipwreck children deaths,1
3058,deaths,,why bsf jawans died fidayeen aks bloody insas insas rifles blame soldiers deaths mod,1
3059,deaths,,breast milk original superfood rates worldwide stalled below contributing child deaths last year,0
3060,deaths,Slovenia,deaths redlight running crashes pedestrians bicyclists vehicle occupants hit redlight runners,1
3061,deaths,,rt k deaths per year physician error avoid them,1
3062,deaths,,cdcwhistleblower deaths measles complications yrs everyone looses shit dead legionnaires month crickets,1
3064,deaths,,bigamist first wife charged deaths second pregnant wife child her news,0
3066,deaths,Uganda,deaths year foodborne illness dears,1
3068,deaths,Gabon,hear talk avoid thousands resistant infectionsdeaths next yrs adiossuperbacterias,0
3070,deaths,,irony just died thousand deaths,0
3071,deaths,,lol usually objective here maybe uncle ben course deaths end up business usual,0
3072,deaths,Nigeria,comment deaths older children data tell us nghlth,1
3073,deaths,Italy,deaths,1
3074,deaths,,never know happened govt seemed think beliefs warranted deaths innocent japs,1
3075,deaths,,real magic real life women went missing ohio town focus fbi probe strange deaths and,1
3077,deaths,Kiribati,two cases constitute epidemic plague health publichealth,1
3079,deaths,Italy,deaths,0
3080,deaths,United Kingdom,lunch stewart julian couple hours earlier good finally find happened them,0
3082,deaths,,weyburn police warn public fentanyl deaths province,1
3083,deaths,Uganda,none annoying crusty all lives matter head ass people ever actually support causes just hate black deaths get attention,0
3084,deaths,,time reduce gun deaths,1
3085,deaths,,stat high auto deaths applies children vehicle guess run lightrail better adult,0
3086,deaths,United Kingdom,cancers equate around deaths blackpool kowing signs save life beclearoncancer,1
3089,deaths,Eritrea,reverse situation lol know civilian deaths specifically utilized make political,1
3090,deaths,United Kingdom,heard theres two deaths murder chrissie kills adam val finn die emmerdale,0
3091,deaths,,died horrible deaths trapped ships knew risk,1
3092,deaths,Jordan,fco minister condemns attack mosque saudi arabia resulted least deaths,1
3093,deaths,United Kingdom,cancers equate around deaths blackpool kowing signs save life beclearoncancer,1
3095,deaths,United States,critters climate two plague deaths colorado,1
3097,deaths,,year angela sanders born roundhouse kick related deaths increased percent,1
3099,deaths,Canada,walmart taking steps keep children safe hot vehicles take look innovative car seat here,0
3100,deaths,Serbia,beluga deaths reported seaworld average age years opseaworld,1
3101,deaths,,bigamist first wife charged deaths second pregnant wife child mothe,1
3102,deaths,Serbia,pls reduce cyclist deaths compulsory highway code test every vehicle road notrocketscience,1
3104,debris,United Kingdom,aerospace exec plane debris missing mh part aircraft wing found reunion island th,1
3105,debris,,malaysia airlines flight disappeared months ago debris found south indian ocean,1
3106,debris,,mh aircraft debris found la reunion missing malaysia airlines,1
3107,debris,,discovered plane debris missing malaysia airlines flight time,1
3108,debris,,confirmed debris mh,1
3109,debris,,mh aircraft debris found la reunion missing malaysia airlines,1
3111,debris,Nigeria,malaysia confirms plane debris washed up reunion island flight mh,1
3112,debris,,mh aircraft debris found la reunion missing malaysia airlines,1
3114,debris,,missing debris floated rìunion new york times,1
3115,debris,,rìunion debris almost surely flight officials say new york times,1
3116,debris,,rìunion debris almost surely flight officials say new york times,1
3117,debris,India,debris found reunion island flight mh mystery behind plane disappearance better novel,1
3118,debris,,mh aircraft debris found la reunion missing malaysia airlines,1
3119,debris,Italy,reuters debris confirmed mh relatives hope discovery crash site,1
3120,debris,United States,nbcnightlynews malaysian officials say debris found reunion island mh billneelynbc reports,1
3122,debris,,mh debris found reunion island sad tragedy innocent crash mh,1
3123,debris,,love food fun malaysian prime minister najib razak confirmed aircraft debris found rìunion isla,1
3124,debris,Canada,malaysia seem certain france plane debris missing mh,1
3125,debris,New Caledonia,malaysian officials say debris found reunion island mh reports,1
3126,debris,,mh aircraft debris found la reunion missing malaysia airlines,1
3130,debris,,debris found reunion island comes mh malaysian pm,1
3131,debris,,aircraft debris found island mh malaysia confirms,1
3132,debris,United States,irony debris flight mh found reunion island,1
3133,debris,India,mh aircraft debris found la reunion missing malaysia airlines abc online,1
3134,debris,Hong Kong,mh reunion debris missing malaysia flight,1
3136,debris,Germany,experts leave lab malaysia confirms debris mh,1
3137,debris,Nigeria,malaysia confirms plane debris washed up reunion island flight mh,1
3138,debris,Iraq,kamindoz reuters debris confirmed mh relatives hope discovery crash s,1
3139,debris,,plane debris discovered reunion island belongs flight mh malaysian pm,1
3140,debris,Iceland,debris confirmed mh relatives hope discovery crash site malaysian officials confirm breakth,1
3141,debris,,abc onlinemh aircraft debris found la reunion missing malaysia airlines abc onlinea piece aircraft debris,1
3142,debris,Hong Kong,malaysia confirms reunion island debris mh,1
3144,debris,,debris confirmed mh relatives hope discovery crash site via video,1
3145,debris,Hong Kong,plane debris missing mh,1
3147,debris,,mh aircraft debris found la reunion missing malaysia airlines abc onlin g malaysia news,1
3150,debris,United Kingdom,interesting mh aircraft debris found la reunion missing malaysia airlines abc please rt,1
3152,debris,Malaysia,aircraft debris confirmed mh nation star online,1
3153,deluge,United States,ah awash abstract dustpig tweets then explains deluge,0
3154,deluge,United Kingdom,bet mother nature might plans send deluge way,0
3155,deluge,Antarctica,feed seems deluge once twice week fantastic,0
3157,deluge,,welcome organizing twitter find important stuff amongst deluge btw loving music signed up ep,0
3158,deluge,,niagara falls package deals deluge tours yyeso,0
3159,deluge,United Kingdom,apologise sincerely inevitable deluge gbbo tweets come hold grudges decide unfollow baking cakes,0
3161,deluge,Chile,rt deluge resources floods medical providers cleanup workers at,1
3162,deluge,,towboat trek sympathy deluge falls vtc,1
3163,deluge,,deluge eulogies cecilthelion whatsapp this tormented soul matias xavier,0
3165,deluge,Australia,wa smiles july deluge west australian via,0
3166,deluge,,china delaying deluge fundamentals economy support valuations stock,0
3167,deluge,,despite deluge fantasticfour notices man ocuana still buying tickets hes bloodyminded like that,0
3168,deluge,,photo forrestmankins colorado camping,0
3170,deluge,Peru,deluge troisrivieres hour get legionstrackandfield,0
3171,deluge,United Kingdom,why many halfnaked men twitter tonight normally embrace odd torso scale tonights deluge unprecedented,0
3172,deluge,,yes man bad week far events deluge favs turned right around,0
3173,deluge,United Kingdom,best windows torrent client recommended deluge looks like written years ago java swing uses worse,0
3174,deluge,,fifth predynastic king legendary period deluge dumuzid the shepherd,0
3175,deluge,,am deluge hell vines,0
3176,deluge,,strange encaustic cerography portion till give voice deluge byityf,0
3177,deluge,Ireland,back beach deluge surf camp motion surf therapy programme kicked off today for,1
3179,deluge,New Zealand,light rain forecast based dressing on light rain incessant deluge,0
3180,deluge,United Kingdom,perhaps historic applied deluge recently exposed childsexabuse truly historic scale coverup,1
3181,deluge,,bible sometimes backs up truck unloads descriptive deluge indecency us explains why next,0
3182,deluge,United States,audio business owners share differently pt,0
3183,deluge,,whole slew updated posts coming hosting fixed unfml deluge,0
3184,deluge,,photo boyhaus heaven sent jakeåê warm morning madison river early evening,0
3185,deluge,,f things gishwhes just got soaked deluge going pads tampons thx,0
3186,deluge,,deluge awesome word idea why like,0
3188,deluge,,wrinkled face deluge decayed,0
3189,deluge,,thanks teaching online class asking students lots questions like this sorry deluge ren art,0
3190,deluge,Gabon,shadowman save big easy deluge supernatural monstrosities read free,0
