id,keyword,location,text,target
1,,,deeds reason earthquake allah forgive,1
4,,,forest fire near la ronge sask canada,1
5,,,residents asked shelter place notified officers evacuation shelter place orders expected,1
6,,,people receive wildfires evacuation orders california,1
7,,,just got sent photo ruby alaska smoke wildfires pours school,1
8,,,rockyfire update california hwy closed directions due lake county fire cafire wildfires,1
10,,,flood disaster heavy rain causes flash flooding streets manitou colorado springs areas,1
13,,,top hill fire woods,1
14,,,theres emergency evacuation happening building street,1
15,,,afraid tornado coming area,1
16,,,three people died heat wave far,1
17,,,haha south tampa getting flooded hah wait second live south tampa gonna gonna fvck flooding,1
18,,,raining flooding florida tampabay tampa days lost count,1
19,,,flood bago myanmar we arrived bago,1
20,,,damage school bus multi car crash breaking,1
23,,,up man,0
24,,,love fruits,0
25,,,summer lovely,0
26,,,car fast,0
28,,,goooooooaaaaaal,0
31,,,ridiculous,0
32,,,london cool,0
33,,,love skiing,0
34,,,wonderful day,0
36,,,looooool,0
37,,,wayi eat shit,0
38,,,nyc last week,0
39,,,love girlfriend,0
40,,,cooool,0
41,,,like pasta,0
44,,,end,0
48,ablaze,United Kingdom,wholesale markets ablaze,1
49,ablaze,Estonia,always try bring heavy metal rt,0
50,ablaze,South Africa,africanbaze breaking newsnigeria flag set ablaze aba,1
52,ablaze,Panama,crying more set ablaze,0
53,ablaze,United Kingdom,plus side look sky last night ablaze,0
54,ablaze,,mufc theyve built hype around new acquisitions doubt set epl ablaze season,0
55,ablaze,,inec office abia set ablaze,1
56,ablaze,,barbados bridgetown jamaica two cars set ablaze santa cruz head st elizabeth police superintende,1
57,ablaze,Kazakhstan,ablaze lord d,0
59,ablaze,United Kingdom,check out nsfw,0
61,ablaze,,outside ablaze alive dead inside,0
62,ablaze,Norway,awesome time visiting cfc head office ancop site ablaze thanks tita vida taking care,0
63,ablaze,,soooo pumped ablaze,0
64,ablaze,,wanted set chicago ablaze preaching hotel,0
65,ablaze,,gained followers last week you know stats grow,0
66,ablaze,United States,west burned thousands wildfires ablaze california alone,1
67,ablaze,,building perfect tracklist life leave streets ablaze,0
68,ablaze,United Kingdom,check out nsfw,0
71,ablaze,United Kingdom,first night retainers in quite weird better get it wear every single night next year least,0
73,ablaze,United Kingdom,deputies man shot brighton home set ablaze,1
74,ablaze,India,man wife get six years jail setting ablaze niece,1
76,ablaze,Barbados,santa cruz head st elizabeth police superintendent lanford salmon r,0
77,ablaze,,police arsonist deliberately set black church north carolinaåêablaze,1
78,ablaze,Nigeria,noches elbestia happy teammates training hard goodnight gunners,0
79,ablaze,United States,kurds trampling turkmen flag later set ablaze others vandalized offices turkmen front diyala,1
80,ablaze,Cameroon,truck ablaze r voortrekker ave outside tambo intl cargo section,1
81,ablaze,Cabo Verde,set hearts ablaze every city gift every skyline like kiss upon lips,0
82,ablaze,,sky ablaze tonight los angeles expecting ig fb filled sunset shots know peeps,0
83,ablaze,Canada,west burned thousands wildfires ablaze california alone climate energy,1
85,ablaze,,revel yours wmv videos means mac farewell ablaze wmv en route dvd gtxrwm,0
86,ablaze,Malaysia,progressive greetings month students set pens ablaze torch publications,0
89,ablaze,India,rene ablaze jacinta secret k fallen skies edit mar,0
91,ablaze,Canada,steve fires something else california tinderbox clown setting hood ablaze,1
92,ablaze,Cabo Verde,nowplaying rene ablaze ian buff magnitude edm,0
93,ablaze,United Kingdom,huge fire wholesale markets ablaze,1
95,ablaze,Dominican Republic,time talk go until know make due work,0
96,accident,,i kids cuz got bicycle accident split testicles impossible kids michael father,0
97,accident,Tunisia,accident i w nashvilletraffic traffic moving m slower usual,1
98,accident,Cabo Verde,accident center lane blocked santaclara us nb great america pkwy bayarea traffic,1
100,accident,Uganda,personalinjury accident summer read advice solicitor help otleyhour,0
102,accident,Sao Tome and Principe,stlouis caraccidentlawyer speeding among top causes teen accidents car accident,0
104,accident,Kenya,reported motor vehicle accident curry herman rd near stephenson involving overturned vehicle please use,1
105,accident,Australia,bigrigradio live accident awareness,1
107,accident,Cameroon,i mile marker south mooresville iredell vehicle accident ramp closed pm,1
109,accident,,rt sleeping pills double risk car accident,0
110,accident,Norfolk Island,by accident knew gon happen,0
112,accident,Dominican Republic,traffic accident n cabrillo hwymagellan av mir,1
113,accident,Cameroon,i mile marker south mooresville iredell vehicle accident congestion pm,1
114,accident,Kenya,pastor scene accidentwho owner range rover,1
117,accident,,mom we get home fast wished me why that mom there accident truck spilt mayonnaise,0
118,accident,,horrible car accident past sunday finally able get around thank god,1
119,accident,,wait pissed donnie tell another accident,0
120,accident,United Kingdom,truckcrash overturns fortworth interstate click crash,1
121,accident,Cameroon,accident ashville sb sr traffic,1
126,accident,,carolina accident motorcyclist dies i crash car crossed median motorcycle rider traveling,1
128,accident,New Caledonia,fyi cadfyi accident property damagenhs piner rdhorndale dr,1
129,accident,Maldives,rt naayf first accident years turning onto chandanee magu near mma taxi rammed halfway turned everyone,1
130,accident,United Kingdom,accident left lane blocked manchester rt nb eddy rd stop go traffic back nha delay mins traffic,1
131,accident,New Caledonia,accident property damage piner rdhorndale dr,1
132,accident,,accident,0
133,accident,New Caledonia,fyi cadfyi accident property damagewpd s th st,1
134,accident,,pm traffic accident injury willis foreman rd,1
135,accident,,aashiqui actress anu aggarwal nearfatal accident,1
136,accident,Canada,suffield alberta accident,1
137,accident,Saint Vincent and the Grenadines,mile backup i southaccident blocking right lanes exit langtree rdconsider nc nc nc alternate,1
138,accident,Estonia,accident changed life help determine options financially support life care plans ongoing treatment,0
139,accident,"Moldova, Republic of",breaking deadly motorcycle car accident happened hagerstown today details whag,1
141,accident,United Kingdom,marinading accident,0
143,accident,,car even week got fucking car accident mfs fucking drive,1
144,accident,Uganda,bahrain police previously died road accident killed explosion,1
145,accident,Kenya,still heard church leaders kenya coming forward comment accident issue disciplinary measuresarrestpastornganga,0
146,aftershock,,scuf ps live game cya,0
149,aftershock,,the man drive further once effort gets painful man win roger bannister,0
151,aftershock,Switzerland,ir icemoon aftershock dubstep trapmusic dnb edm dance,0
153,aftershock,,there victory bargain basement prices dwight david eisenhower,0
156,aftershock,United States,ir icemoon aftershock dubstep trapmusic dnb edm dance,0
157,aftershock,,nobody remembers came second charles schulz,0
158,aftershock,,speaking someone scuf xb people end up getting ps also,0
159,aftershock,,the harder conflict glorious triumph thomas paine,0
160,aftershock,,growingupspoiled going clay pigeon shooting crying aftershock,0
161,aftershock,United Kingdom,guess actually wants free aftershock tc,0
162,aftershock,,aftershock terrifying best roller coaster ever on disclaimer few,0
163,aftershock,Belgium,aftershock,0
164,aftershock,Switzerland,ir icemoon aftershock dubstep trapmusic dnb edm dance,0
165,aftershock,United States,ir icemoon aftershock dubstep trapmusic dnb edm dance,0
168,aftershock,,ir icemoon aftershock dubstep trapmusic dnb edm dance,0
170,aftershock,,seeing issues aftershock,0
171,aftershock,Switzerland,ir icemoon aftershock dubstep trapmusic dnb edm dance,0
172,aftershock,Switzerland,ir icemoon aftershock dubstep trapmusic dnb edm dance,0
173,aftershock,Canada,wisdomwed bonus minute daily habits really improve life many already do lifehacks,0
174,aftershock,United States Minor Outlying Islands,aftershock protect yourself profit next global financial meltdown david wiedemer http,0
175,aftershock,,moment get scary roller coaster guy behind just screaming bloody murder silverwood aftershock,0
176,aftershock,,aftershock streaming youtube,0
178,aftershock,United States,aftershock protect yourself profit next global financial book,0
180,aftershock,,sometimes face difficulties something wrong something right joel osteen,0
182,aftershock,,the thing stands dream try belief actually possible joel brown,0
183,aftershock,Canada,praise god ministry tells like is now wdyouth biblestudy,0
184,aftershock,,remembering going die best way know avoid trap thinking something lose steve jobs,0
185,aftershock,Canada,tried orange aftershock today life never same,0
187,aftershock,,love bb,0
190,aftershock,,aftershock,0
191,aftershock,,aftershock back school kick off great thank everyone making possible great night,0
193,aftershock,,people say interrupt it george bernard shaw,0
194,aftershock,,the first man gets oyster second man gets shell andrew carnegie,0
195,aftershock,,anyone need pu tonight play hybrid slayer ps eu hmu,0
196,airplane%20accident,,experts france begin examining airplane debris found reunion island french air accident experts o news,1
197,airplane%20accident,United States,strict liability context airplane accident pilot error common component aviation cr,1
198,airplane%20accident,Argentina,lifetime odds dying airplane accident,0
199,airplane%20accident,Paraguay,experts france begin examining airplane debris found reunion island french air accident experts wedn,1
201,airplane%20accident,,awwww theyre airplane accident theyre gonna die cuties good job,1
203,airplane%20accident,Spain,family members osama bin laden died airplane accident ironic mhmmm gov shit suspect,1
204,airplane%20accident,India,man goes airplane engine accident via,1
205,airplane%20accident,India,horrible accident man died wings airplane,1
208,airplane%20accident,Burkina Faso,cessna airplane accident ocampo coahuila mexico july killed four men including state coahuila government official,1
209,airplane%20accident,,horrible accident man died wings airplane watchthevideo,1
210,airplane%20accident,Andorra,experts france begin examining airplane debris found reunion island french air accident experts,1
211,airplane%20accident,,experts france begin examining airplane debris found reunion island french air accident experts wednesday began examining t,1
212,airplane%20accident,Indonesia,kca votejktid mbataweel rip binladen family members killed airplanes accident,1
213,airplane%20accident,,almost sent coworker nudes accident thank god airplane mode,0
215,airplane%20accident,New Caledonia,might killed airplane accident night car wreck politics best,0
216,airplane%20accident,United Kingdom,experts france begin examining airplane debris found reunion island french air accident experts on mlb,1
218,airplane%20accident,,unbelievably insane man airport airplane aircraft aeroplane runway accident,1
219,airplane%20accident,India,horrible accident man died wings airplaneåê,1
220,airplane%20accident,Sri Lanka,horrible accident man died wings airplane,1
221,airplane%20accident,United Kingdom,usama bin ladins family dead airplane crash naturally accident,1
222,airplane%20accident,,pilot dies plane crash car festival via crash aircraft airplane pilot death accident carfest,1
225,airplane%20accident,Philippines,strict liability context airplane accident,1
226,airplane%20accident,Canada,dtn brazil experts france begin examining airplane debris found reunion island french air accident exp,1
229,airplane%20accident,,experts france begin examining airplane debris found reunion island french air accident experts wedn,1
231,airplane%20accident,,horrible accident man died wings wtf believe eyes,1
232,airplane%20accident,,nicole fletcher victim crashed airplane few times ago accident left little bit trauma her although shes,1
235,airplane%20accident,India,omg horrible accident man died wings airplane,1
237,airplane%20accident,,omg believe this rip bro airplane accident jetengine turbojet boing g,1
238,airplane%20accident,,experts france begin examining airplane debris found reunion island french air accident experts wednesday began examining t,1
240,airplane%20accident,Israel,airplane accident,1
241,airplane%20accident,Slovenia,phone looks like car ship airplane accident terrible,0
242,airplane%20accident,Dominican Republic,statistically risk getting killed cop dying airplane accident,0
243,airplane%20accident,Italy,airplane crashes house colombia people die accident,1
244,airplane%20accident,,shooting airplane accident,1
245,airplane%20accident,,drone cause airplane accident pilots worried drones esp close vicinity airports,1
246,ambulance,,early wake up call sister begging come ride wher ambulance hospital rodkiai,1
247,ambulance,,twelve feared killed pakistani air ambulance helicopter crash,1
248,ambulance,New Caledonia,two air ambulances scene serious crash two cars lorry,1
249,ambulance,,twelve feared killed pakistani air ambulance helicopter crash reuters yugvani,1
251,ambulance,New Caledonia,leading emergency services boss welcomes new ambulance charity,0
252,ambulance,Cameroon,anyone travelling aberystwythshrewsbury right theres incident services halt just outside shrews ambulance scene,1
253,ambulance,,twelve feared killed pakistani air ambulance helicopter crash,1
254,ambulance,United Kingdom,ambulance sprinter automatic frontline vehicle choice lez compliant ebay,0
256,ambulance,United Kingdom,new nanotech device able target destroy blood clots,0
258,ambulance,United States,hella crazy fights ambulance couple mosh pits,1
260,ambulance,,get run ambulance lucky justsaying randomthought,0
261,ambulance,,news twelve feared killed pakistani air ambulance helicopter crash tilnow dna,1
262,ambulance,,twelve feared killed pakistani air ambulance helicopter crash,1
263,ambulance,,waiting ambulance,0
264,ambulance,,ok need ambulance hahahah good,0
265,ambulance,United Kingdom,ambulance sprinter automatic frontline vehicle choice lez compliant ebay,0
266,ambulance,,pakistan air ambulance helicopter crash kills nine,1
267,ambulance,Russian Federation,nissan ok need medical assistance call ambulance need,0
268,ambulance,Cameroon,ems ny emts petition per hour ems paramedics ambulance,0
269,ambulance,,twelve feared killed pakistani air ambulance helicopter crash,1
270,ambulance,,twelve feared killed pakistani air ambulance helicopter crash,1
271,ambulance,United Kingdom,ambulance sprinter automatic frontline vehicle choice lez compliant ebay,0
272,ambulance,United Kingdom,ambulance sprinter automatic frontline vehicle choice lez compliant ebay,0
273,ambulance,United States,check parking lot last year ambulance st johns,0
274,ambulance,Slovenia,know way ambulance coming,1
276,ambulance,,reuters twelve feared killed pakistani air ambulance helicopter crash,1
277,ambulance,United Kingdom,twelve feared killed pakistani air ambulance helicopter crash,1
279,ambulance,,why ambulance right outside work,0
280,ambulance,Canada,dog thinks hes ambulance,0
281,ambulance,Malaysia,happening hatzolah ems ambulance responding dual sirens,0
283,ambulance,,twelve feared killed pakistani air ambulance helicopter crash,1
285,ambulance,,twelve feared killed pakistani air ambulance helicopter crash,1
287,ambulance,United States,twelve feared killed pakistani air ambulance helicopter crash worldnews,1
289,ambulance,Germany,twelve feared killed pakistani air ambulance helicopter crash worldnews,1
290,ambulance,,police ambulance number lesotho body know,0
291,ambulance,,surprised still standardised clinical practice nhs ambulance trust,0
293,ambulance,,twelve feared killed pakistani air ambulance helicopter crash,1
294,ambulance,New Caledonia,people try jwalk ambulance passing hate you,0
296,annihilated,,episode trunks annihilated freiza cleanest shit ever showed nigga mercy,0
297,annihilated,Philippines,shall annihilated petebests dessicated laid bare shall kneel me,0
298,annihilated,New Caledonia,uribe just annihilated baseball mets,0
299,annihilated,,heysundowns annihilated previous meeting celticindeed improvement,0
301,annihilated,,mizzou annihilated florida past seasons even ended muschamps career just compete bama,0
302,annihilated,,annihilated abs,1
303,annihilated,,annihilated status education mba behalf easy street careen eovm,0
307,annihilated,Maldives,to luka die them everything annihilated alois trancy,0
309,annihilated,Ghana,good un fella sorry get annihilated,0
310,annihilated,,cop pulls drunk driver safety seconds car hit train via,1
312,annihilated,,annihilated,0
313,annihilated,,cop pulls drunk driver safety seconds car hit train via,1
314,annihilated,Eritrea,boom country just entirely annihilated britain,0
315,annihilated,,annihilated might well thank,0
316,annihilated,United States,thing suregod promised israel annihilated butthe horror iran wnukes,0
318,annihilated,,guess thats ok armenians spent history getting annihilated,1
320,annihilated,,years annihilated people instantly became aware ability annihilate whole humanity,1
321,annihilated,Eritrea,day tryouts went good minus fact stopped quickly get short ball annihilated toenail injury even,0
322,annihilated,United Kingdom,s oryx symbol arabian peninsula annihilated hunters,1
327,annihilated,,to luka they die them everything annihilated alois trancy,0
328,annihilated,,ready get annihilated bucs game,1
329,annihilated,Cameroon,people annihilated last nights weather really philip thought forecast that,1
330,annihilated,,domain sophistication annihilated closely uptotheminute feat zrnf,0
331,annihilated,Cameroon,seen judas priest rob came back scorpions support fucking annihilated place astonishing gig,0
332,annihilated,Panama,officially skipping fantasticfourfantsticwhatever hashtag is getting annihilated reviews bummer,0
334,annihilated,,thus explaining why annihilated few case survivor evolved became godlike,1
335,annihilated,Uganda,just completely annihilated cech paul keegan time alive,0
336,annihilated,,who annihilated legion itself survivors imperfect hybrid project quickly formed new secret cell,0
337,annihilated,Bulgaria,exactly thats why lesnarcena match summerslam last year great brock annihilated guy,0
338,annihilated,,cop pulls drunk driver safety seconds car hit train via,1
340,annihilated,,annihilated damascus syrian army grinds gang manure pile,1
341,annihilated,,ok completely forthright food coma bc kebabtahinipickles annihilated wfries,0
344,annihilated,United Kingdom,fun filled happyhour simmons bar camden handsome i got annihilated apart game,0
345,annihilated,,juanny beisbol sr annihilated ball lgm,0
346,annihilation,United States,hell just fraction belief total annihilation destruction usa,1
347,annihilation,,maybe call israel tell sorry pres sold down river annihilation,0
348,annihilation,,evildead annihilation civilization,0
349,annihilation,,us national park services tonto national forest stop annihilation salt river wild horse via,0
352,annihilation,,annihilating quarterstaff annihilation,1
353,annihilation,Lao People's Democratic Republic,world annihilation vs self transformation aliens attack exterminate humans,0
354,annihilation,Spain,starmade stardate planetary annihilation via,1
355,annihilation,,us national park services tonto national forest stop annihilation salt river wild horse via,0
356,annihilation,Canada,us national park services tonto national forest stop annihilation salt river wild horse via,1
358,annihilation,Montenegro,please sign share petition save wild horses arizona,0
360,annihilation,,us national park services tonto national forest stop annihilation salt river wild horse via,1
361,annihilation,Canada,please check salt river horses help stop annihilation happen signatureschange org thx,0
363,annihilation,United States,souls punished withåêannihilation,0
364,annihilation,,mention major contributor annihilation israel,1
365,annihilation,,need help horses dieplease rt sign petitiontake stand voice them gilbert,1
368,annihilation,United Kingdom,reject laws misguided false prophets imprison nations fueling self annihilation,0
370,annihilation,Azerbaijan,us national park services tonto national forest stop annihilation salt river wild horse via,0
371,annihilation,Russian Federation,annihilation jeb christie kasich less hours away please god allow least full day,0
372,annihilation,,need helphorses die please rt sign petition take stand voice them gilbert,0
375,annihilation,,need help horses dieplease rt sign petitiontake stand voice them gilbert,0
380,annihilation,Kiribati,hey az sign petition save wildhorses tantonationalforest singalong order,0
381,annihilation,Slovenia,stop annihilation salt river wild horses via,1
383,annihilation,United States,hes current nova bookslast checkedhe tied books rider died annihilation,0
384,annihilation,,us national park services tonto national forest stop annihilation salt river wild horse via,0
386,annihilation,,please sign rt save saltriverwildhorses,0
389,annihilation,,thanks dante join following zone johnny,0
390,annihilation,Lao People's Democratic Republic,world annihilation vs self transformation aliens attack exterminate humans,1
393,annihilation,Bangladesh,us national park services tonto national forest stop annihilation salt river wild horse via,0
394,annihilation,Azerbaijan,us national park services tonto national forest stop annihilation salt river wild horse via,1
396,apocalypse,United States,gonna fight taylor soon get there,0
397,apocalypse,,ohh fukurodani survive apocalypse bokuto feels horrible poor boy ppor child,1
398,apocalypse,,another jocelyn birthday apocalypse,0
401,apocalypse,,rt janenelson rt stephenscifi adaptation watch charlie humans apocalypse optioned film sciencefiction,0
402,apocalypse,United States,apocalypse please,0
404,apocalypse,Poland,another hour august pm heres red rover zombie apocalypse internetradio,1
406,apocalypse,United States,feel like pullup stages apocalypse,0
407,apocalypse,,shes kinda hot played radio today next disease all apocalypse started everyone careful,0
409,apocalypse,Eritrea,apocalypse lol gf m,0
410,apocalypse,,know question interpretation sign apocalypse called,1
412,apocalypse,,julie r apocalypse version romeo juliet warmbodies,0
413,apocalypse,,apocalypse upon,0
415,apocalypse,,rt fittscott minecraft night lucky block mod bob apocalypse wither more mod showcase popularmmos,0
418,apocalypse,,begins day snow apocalypse,1
419,apocalypse,,rt ourmothermary short reading apocalypse spirit angel took top enormous high mountain and,0
420,apocalypse,Argentina,candylit imagine sarumi zombie apocalypse fighting back back heart heart conversations the,0
421,apocalypse,,rt zonewolf liked youtube video minecraft night lucky block mod bob apocalypse wither more,0
423,apocalypse,,thats planet lone audience apocalypse,0
424,apocalypse,Dominican Republic,dad bought dvd looks like science doc front read back actually impending biblical apocalypse,1
426,apocalypse,Dominican Republic,indeed apocalypse comes week know,0
427,apocalypse,United States,go look grizzly peak right now looks like beginning dystopian apocalypse movie,0
429,apocalypse,,niece just asked would scared apocalypse here,0
432,apocalypse,Kenya,theres storm cairo latest xmen apocalypse set photo via,1
435,apocalypse,,minecraft night lucky block mod bob apocalypse wither more mod showcase popularmmos via,0
436,apocalypse,,shot heart xv going totally give love bad name heart pierc,0
437,apocalypse,,rt geekapocalypse pm gmt hesse plays dark souls day etcpb,0
438,apocalypse,Russian Federation,know go zombies take over,0
440,apocalypse,,latest reveals storm queen apocalypse,1
442,apocalypse,,shadow boxing apocalypse,1
443,apocalypse,,short reading apocalypse spirit angel took top enormous high mountain and,1
444,apocalypse,Japan,enjoyed liveaction attack titan every time posters reminded freshly clean coiffed everyone apocalypse,0
445,apocalypse,,liked video minecraft night lucky block mod bob apocalypse wither more mod showcase,0
446,armageddon,United States,pbban temporary avysss armageddon kill flags fast xp reason,0
447,armageddon,United States,pbban temporary russaky armageddon kill flags fast xp reason,0
448,armageddon,Uganda,official vid doublecups prod armageddon,0
450,armageddon,,ouvindo peace love armageddon,0
451,armageddon,,best movie ever seen armageddon,0
452,armageddon,Estonia,bed time wake up unless revolution armageddon start,0
453,armageddon,,red faction armageddon microsoft xbox full read ebay,0
454,armageddon,United Kingdom,already know shit goes world series armageddon,0
455,armageddon,,rt love truelove romance lith voodoo seduction astrology rtrrt lotz apocalypse armageddon,0
456,armageddon,Eritrea,im gonna beat armageddon hsu hao just got flawless first try,0
457,armageddon,Canada,ben afflecki know theres wifekids girls help it loved armageddon eonlinechat,0
459,armageddon,United Kingdom,if long coat hand worn it certainty armageddon bears sense occasion,0
461,armageddon,United States,phone spying you hidden back door nsa data mining software financial armageddon blog,0
462,armageddon,United States,pbban temporary hyiderghost armageddon kill flags fast xp reason,1
463,armageddon,,rt love truelove romance lith voodoo seduction astrology rtrrt lotz apocalypse armageddon,0
465,armageddon,United States,pbban temporary fighterdena armageddon kill flags fast xp reason,0
466,armageddon,New Caledonia,photo sketch based taste armageddon episode startrek tos,0
467,armageddon,Costa Rica,armageddon,1
