id,keyword,location,text,target
5306,fear,United Kingdom,gd ideas wrked hard almost nothing fear lives poor fran reed,0
5308,fear,New Caledonia,never let fear get way achieving dreams deltachildren instaquote quoteoftheday disney waltdisney,0
5309,fear,Sao Tome and Principe,fear motivator,0
5310,fear,United States,daily reflections august driven driven hundred forms fear selfdelusion selfseeking selfpity,0
5313,fire,,morganite gemstone white fire opal sterling silver ring size r,0
5315,fire,"Saint Helena, Ascension and Tristan da Cunha",marquei como visto game thrones x kissed fire bancodeseries,0
5316,fire,,save date saturday august salisbury fire department open house cypress st am to,0
5317,fire,,why put fire still burning,0
5319,fire,United Kingdom,cause fire fire fire now yeah fire fire fire nowwwwww,1
5320,fire,,avi header combo fire,0
5321,fire,United Kingdom,auction shoes retro fire red,0
5322,fire,,asshole fire,0
5323,fire,Bangladesh,crying song just ended setting myself fire,0
5324,fire,,setting things fire always option,1
5325,fire,,sitting around fire sounds great right,0
5326,fire,,fire,0
5328,fire,,put flood fire top list,1
5330,fire,Canada,fire,0
5331,fire,Tonga,politifiact harry reids percent women served planned parenthood claim pants fire lie tcot,0
5332,fire,Mongolia,dear brought canonbringit fire canontattoo mn theresmorewherethatcamefrom,0
5335,fire,,yeah just need another middle class hating republican get hard working cops fire fighters teachers,0
5336,fire,,fire way close wtf going,1
5337,fire,United Kingdom,fire meet gasoline always gotta get played twice lol,0
5338,fire,United Kingdom,wcw tha bitch fire,0
5339,fire,Guatemala,well feels like fire,0
5341,fire,United States,eyes words icy burns like rum fire,0
5342,fire,,news politifiact harry reids percent women served planned parenthood claim pants fire lie,0
5343,fire,,nothing like good fire,1
5344,fire,,tenshi activated yukis fire card,0
5345,fire,France,california shakingcatching fireand overcharging ppl rent past years aint going nowhere,1
5346,fire,United States,theres fire catalinas looks kinda cool picture justice,1
5347,fire,,overwork yourself album gonna fire just overwork stress love take care,0
5349,fire,,promise tax pancakes rainbows dying fire,0
5350,fire,Slovenia,nigga cyhi diss meek suppose do shit actually fire,0
5351,fire,Eritrea,wanna set shit fire,1
5352,fire,Eritrea,words charlie daniels fire mountain run boys,1
5353,fire,Australia,just checked in fire lovefood,1
5354,fire,Kazakhstan,heart bigger obstacles front euro dontexpectnothing july fire,0
5355,fire,,fire waves darkness,0
5356,fire,Bulgaria,seem like fire little burnt out,0
5357,fire,,smelling bon fire driving makes wanna sitting near making smores,1
5359,fire,Eritrea,dropping fire selfie tomorrow saying youre welcome ahead time,0
5362,fire%20truck,Canada,fire call brant av drummond rd fire structure single units car call truck,1
5365,fire%20truck,Kazakhstan,psa day fire truck behind lights going move over get call,0
5366,fire%20truck,United States,rfp fire truck service body f fire fighting rescue safety equipment transporta,0
5367,fire%20truck,,reno truck trailer catches fire reno,1
5368,fire%20truck,,wild night village pugwash every fire truck town like fire truck every house population,1
5371,fire%20truck,Costa Rica,an wheeler came struck fire truck spinning around degrees causing roll over,1
5372,fire%20truck,Uganda,sigalert update n closed fwy ufn trash truck fire,1
5373,fire%20truck,Mauritius,look like murder scene just cops fire truck fire assistance cars helicopter,1
5375,fire%20truck,,former township fire truck philippines langley times philippines,1
5377,fire%20truck,,former township fire truck philippines township langley assistant fire chief pat walker spen,1
5378,fire%20truck,,garbage truck really caught fire lmfao,0
5379,fire%20truck,,northgate taco truck thats fire,1
5380,fire%20truck,,never good sign pull up work theres five ambulances fire truck bay wompppp least friday,1
5381,fire%20truck,,fire truck ambulance k phase hope everyones okay prayforsaipan,1
5382,fire%20truck,Belize,sigalert north southbound closed btwn fwy irvine blvd due truck fire chp detouring traffic,1
5383,fire%20truck,India,true truck caught fire,1
5384,fire%20truck,,ohgod xd mean p fire truck back make up good xd,0
5385,fire%20truck,United Kingdom,came fire video mineenjoybabes way saying hi hes fire truck fireman,0
5386,fire%20truck,Chile,n past l lane reopened lanes closed lanes open s trash truck fire cleanup,1
5387,fire%20truck,Belize,sigalert north southbound closed btwn fwy irvine blvd due truck fire chp detouring traffic,1
5389,fire%20truck,United Kingdom,found cool photo mine dodge wayne bodied window bus ex libby mt fire department truck,1
5391,fire%20truck,,trident chevy fire truck w pumper ims fire dept red ho plastic,0
5392,fire%20truck,Iceland,toddler bedding firetruck bundle fire truck firefighter sticker decals sign wall,0
5396,fire%20truck,,monster truck racer catches fire fair,1
5397,fire%20truck,Philippines,truck fire clogs canyon road,1
5400,fire%20truck,United States,rgj truck trailer catches fire reno,1
5403,fire%20truck,,philippines former township fire truck philippines emergency equipment cebu philippi,1
5404,fire%20truck,Lao People's Democratic Republic,theres fire truck parking lot,0
5406,fire%20truck,,evening sun article nno,0
5407,fire%20truck,,choose happy fire truck rest review kick push,0
5408,fire%20truck,,former township fire truck philippines langley times filipino,0
5409,fire%20truck,,jacksonville fire rescue engine awesome truck official jade fl via,1
5410,fire%20truck,Brazil,njturnpike å njturnpike reopens hours truck fire in,1
5411,first%20responders,,lukebox something first responders military true heros besides music,0
5412,first%20responders,United States,grateful first responders others acted swiftly save countless lives today,1
5413,first%20responders,United States,praying gods healing safety first responders,0
5416,first%20responders,Bahamas,join charity k run event am start sun sept castle donington community first responders,0
5417,first%20responders,,loved way book written include many vantage points first responders kindle,0
5418,first%20responders,,first responders never sent wrong address again w smartteks gpsbased panic button mpers safety,0
5420,first%20responders,India,denver firefighter working curb first responder suicide,1
5423,first%20responders,Australia,cool teens becoming like call digital first responders friends need little help support,0
5425,first%20responders,,carmike cinemas antioch shooting we grateful staff first responders safety highest priority,1
5426,first%20responders,,rt roadid thanks alex story first responders need you,0
5428,first%20responders,New Caledonia,just added sandy first responders lost homes vip home page group,1
5430,first%20responders,Tunisia,thankful first responders especially life saving response today antioch,1
5432,first%20responders,,juneau empire first responders turn national night,0
5437,first%20responders,United States,throw word hero around lightly usually reserved first responders military hes hero,0
5439,first%20responders,United Kingdom,wants future first responders hightech,0
5442,first%20responders,Chile,theres still room party first responders around country rd annual best ever,0
5443,first%20responders,United Kingdom,incase accident first responders know baby present,0
5444,first%20responders,United States,kirsten gillibrand extend health care first responders,1
5445,first%20responders,United States,we help denver firefighter working curb first responder suicide,1
5446,first%20responders,United States,first responders convene national summit awards gis technology gisuserpr geotech,0
5448,first%20responders,,york co first responders compete save lives paramedic ems,0
5449,first%20responders,United States,good info help first responders cope individual resilience factsheet responders,0
5450,first%20responders,,lives lost except first responders public theyre charged protecting,1
5452,first%20responders,United Kingdom,first responders get int free saturday details,0
5454,first%20responders,United Kingdom,day emergency services display meeting brave police firefighters first responders help keep safe,1
5455,first%20responders,,week first responders dart members participating four day intensive technical large animal,1
5458,first%20responders,Canada,firefighters make gains rockyfire jerry brown heading area meet first responders tomorrow morning,1
5459,first%20responders,Tunisia,shooting event theater giving free coffee first responders police firefighters antiochhickoryhollowtn,1
5460,first%20responders,Sao Tome and Principe,no lender fees veterans first responders past present,0
5461,flames,,new giant flames giant full black pantofel infoorder sms pin pictwittercompnpizody,1
5462,flames,New Caledonia,new snap tools black baseball hatcap silvergray embroidered s logo flames full,0
5465,flames,New Caledonia,new snap tools black baseball hatcap silvergray embroidered s logo flames full,0
5466,flames,Cayman Islands,vampiro going table flames ultimalucha luchaunderground,0
5467,flames,,cabin fever flames,0
5468,flames,Kenya,if summon flames directly hell store bought fineme momdies,0
5469,flames,Bahamas,just added fire flames saturday rick wonder spinning guest set chachi,0
5471,flames,,yoga flames,0
5473,flames,,sbnation flames makes good penalty killer,0
5475,flames,South Sudan,guess say igs hopes went up flames,0
5476,flames,,cry pity partys flames,0
5477,flames,,new lil b x chance nothing flames,0
5479,flames,Greece,wish good enough add flames nails fire,1
5480,flames,New Caledonia,gang walking round brown flames thats nd,0
5481,flames,New Caledonia,new snap tools black baseball hatcap silvergray embroidered s logo flames full,0
5482,flames,Sao Tome and Principe,dude just smoking fucking thing went up flames though bomb went off omg scared,1
5484,flames,,maryland mansion fire killed caused damaged plug christmas tree report flames,1
5485,flames,,new giant flames giant manly brown infoorder sms pind,0
5486,flames,United States,devastation firefighters continue battle flames california benstracy reports,1
5487,flames,,watching go up flames,1
5488,flames,Sudan,rp smoke coming silo th street hartford flames,1
5489,flames,,chose search joy just two near smiles matter cold flames burn bod portgassdk,0
5491,flames,,maryland mansion fire killed caused damaged plug christmas tree report flames firefighters bravery,1
5492,flames,Estonia,everyone setting flames upon,0
5493,flames,Holy See (Vatican City State),thats optimistic side me doubt tough done feel like games pivot defense,0
5494,flames,United States,maryland mansion fire killed caused damaged plug christmas tree report flames,1
5495,flames,United Kingdom,pardon burst flames enough world peoples mindless games,0
5496,flames,Eritrea,burst flames anna hugged tightly,0
5497,flames,Uganda,selmo u catching flames just gonna witnessing slaughter,1
5498,flames,,bloody ell let burn rubybot,0
5499,flames,,opinion put thh internet furst flames,0
5501,flames,,rising follower graph followers past week get stats right,0
5502,flames,Fiji,just gray ophelia red flames blazing around person setting nearly everything area,1
5503,flames,Dominican Republic,soloquiero maryland mansion fire killed caused damaged plug christmas tree report flames firefighte,1
5505,flames,Morocco,maryland mansion fire killed caused damaged plug christmas tree report flames,1
5506,flames,,better make shots tomorrow cause recording flames thrown tomorrow,0
5507,flames,Estonia,added video playlist nicki minaj up flames official video,0
5509,flames,,better sean bro admit sean flames now better sean,0
5510,flames,,advantages apropos flames favorable regard mississauga ontario pwhvgwax,0
5514,flattened,United Kingdom,flattened cartoonylike whoa papa,0
5515,flattened,,road success paved pennies flattened train tracks welcome,0
5517,flattened,United Kingdom,feel like flattened sumo wrestler pain gain muaytai wantmyabsback strong,0
5518,flattened,"Iran, Islamic Republic of",ideas food flattened,0
5519,flattened,United Kingdom,zouma just flattened cfc,0
5520,flattened,United Kingdom,zouma just absolutely flattened guy,0
5521,flattened,Marshall Islands,flattened,0
5522,flattened,Australia,years ago first atomic attack flattened hiroshima days later nagasaki war crimes put moscow place,1
5524,flattened,Uganda,today august th th anniversary abomb little boy dropped hiroshima killed outright city flattened,1
5525,flattened,United Kingdom,just flattened little midget,0
5526,flattened,New Caledonia,this yosemite sam drumpf vote flattened rabbit skin ahuh huh always,0
5528,flattened,Uganda,flattened machidadid lose fightnope lost fights guys shouldnt lost,1
5529,flattened,Barbados,floored flattened early birds get de cups lag bout pun de dock watch ppl,0
5531,flattened,,conklin flattened shuffled feet kick slide get hands up chest,0
5532,flattened,United Kingdom,flattened thee striker,1
5534,flattened,United Kingdom,picking up flattened hay men masonite wahpeton nd,0
5535,flattened,,zouma just flattened guy,0
5538,flattened,United Kingdom,fylde building set flattened city centre iconic buildings disappearing skyline,0
5539,flattened,,hide kids hide wife hes loose thought flattened ball,0
5540,flattened,,wouldve great mbiwa just flattened little rat,0
5541,flattened,United Kingdom,puckflattened ball lol,0
5544,flattened,,doubt it implicit statement makes flattened bus,0
5545,flattened,United Kingdom,flattened raynor raynor balding imperfect biker marine emo generic western hero,0
5547,flattened,United States,think risk losing getting nose flattened lot,0
5548,flattened,United Kingdom,mums literally just picked up new car today flattened battery already trying sort bluetooth muppet,0
5552,flattened,Canada,notley flattened harper heartland harper imported tens thousands tfw slaves cost albertans jobs,0
5553,flattened,India,flattened frog,0
5554,flattened,United Kingdom,imagine getting flattened kurt zouma,0
5555,flattened,,the fallacy up steam roller up object flattened not robertcalifornia thereisonlysex,0
5556,flattened,"Moldova, Republic of",photo beach earrings beach jewelry vacation earrings keep calm beach earrings made flattened,0
5557,flattened,,mix new flat double sided linerless bottle caps choose mix flattened full,0
5558,flattened,Cameroon,flat footballs like flattened spartans crushing back day hail,0
5559,flattened,Eritrea,ever seen far dreamy look came face ears flattened started walk slowly toward her youd,1
5560,flattened,New Caledonia,mix new flat double sided linerless bottle caps choose mix flattened full,0
5561,flood,,fizzy sitting regular flood seats knows is,0
5563,flood,United States,jkl cancels flash flood warning bell harlan knox ky wx,1
5564,flood,New Caledonia,spot flood combo inch w curved cree led work light bar x offroad fog lamp full,1
5565,flood,New Caledonia,spot flood combo inch w curved cree led work light bar x offroad fog lamp full,0
5567,flood,Australia,small flood bigåêconsequences,1
5569,flood,British Indian Ocean Territory,homecoming queen killed way home prom flood waters socialnews,1
5570,flood,,pcs w cree led work light offroad lamp car truck boat mining wd flood beam full,0
5573,flood,,raining left drowning flood always fighter give up,0
5575,flood,,yet still why many fish die worldwide flood wonder,0
5576,flood,,please flood poor s mentions hes put work,1
5577,flood,New Caledonia,spot flood combo inch w curved cree led work light bar x offroad fog lamp full,0
5578,flood,Türkiye,,0
5579,flood,New Caledonia,w cree led work light bar alloy spot flood combo diving offroad wd boat full,0
5580,flood,New Caledonia,pcs w cree led work light offroad lamp car truck boat mining wd flood beam full,1
5581,flood,Canada,cue flood people ironically calling,0
5582,flood,United States,motors hot deals x w v v led work light flood lamp tractor truck suv utv,0
5584,flood,,vv w led warm white light motion sensor outdoor flood light pir lamp auc,0
5586,flood,United States,iembothfo nnw hana maui co hi county official reports coastal flood,1
5587,flood,New Caledonia,pair new w round led work driving flood light offroad atv utv full read ebay,0
5588,flood,New Caledonia,pcs w cree led work light offroad lamp car truck boat mining wd flood beam full,0
5589,flood,,internet basics flood defective intertissue soul mate milk trench host guabxfv,1
5590,flood,,bmx issues areal flood advisory shelby al till aug pm cdt,1
5592,flood,New Caledonia,pcs w cree led work light offroad lamp car truck boat mining wd flood beam full,0
5593,flood,United States,flood advisory effect shelby county al pm alwx,1
5594,flood,United States,rt grantfactory grants funds weymouth meeting seawalls flood grants set thursday night,1
5595,flood,New Caledonia,spot flood combo inch w curved cree led work light bar x offroad fog lamp full,0
5598,flood,New Caledonia,spot flood combo inch w curved cree led work light bar x offroad fog lamp full,0
5599,flood,New Caledonia,spot flood combo inch w curved cree led work light bar x offroad fog lamp full,0
5600,flood,United States,flood advisory issued august pm edt nws wxky,1
5602,flood,,survived plague floated flood just peeked heads mud ones immune deafening bells god survive ourselves,0
5603,flood,New Caledonia,spot flood combo inch w curved cree led work light bar x offroad fog lamp full,0
5604,flood,United States,flood prone waterways westchester county eligible millions state aid newyork,1
5605,flood,,chinese rescue team arrives myanmar help flood victims sittway,1
5608,flood,Tunisia,flood advisory issued august pm cdt august pm cdt nws the urban weather,1
5609,flood,New Caledonia,w cree led work light bar alloy spot flood combo diving offroad wd boat full,0
5611,flooding,United Kingdom,rock springs residents living off elk street continue battle flooding issues rain storm,1
5612,flooding,Viet Nam,cuban leader extends sympathy vietnam flooding,1
5613,flooding,Iceland,business sponge docks washed rain flooding,1
5614,flooding,,thrusts little jams cock deep inside flooding womb pussy hot thick cum,0
5617,flooding,United States,severe thunderstorms flash flooding possible midsouth midwest weather environment climate nature,1
5618,flooding,United States,a radar update widespread showersstorms moving same areasminor flooding possible hunwx,1
5619,flooding,Latvia,tips prevent basement leaks create control joints eliminate random cracking homeimprovement flooding,0
5620,flooding,,flooding,1
5621,flooding,France,reported flooding po area ten mmda,0
5622,flooding,,flooding kills displace million pakistan daily news analysis yugvani,1
5624,flooding,,flooding kills displace million pakistan daily news analysis,1
5625,flooding,,laos flooding villages underwater world vision responding,1
5626,flooding,Uganda,floods ukfloods british trekkers rescued amid flash floods himalayas group british tr flooding,1
5627,flooding,,maybe plan dilute safely say we start charging over longs come flooding in,0
5628,flooding,Viet Nam,cuban leader extends sympathy vietnam flooding,1
5629,flooding,,ill dm hotel info people flooding notifications asking info,0
5631,flooding,United Kingdom,waves flooding shore find way home anymore thats look,1
5632,flooding,United States,flooding occurs home stop mold growth via,1
5633,flooding,,flooding tracks caused derailment sa insubcontinent,1
5634,flooding,Iceland,chinese flooding nyc market like never,0
5635,flooding,Russian Federation,obama keeps iraqi christian asylum seekers ndetention flooding us wunscreened muslims via,1
5638,flooding,United States,grateful support flooding dinner guests thank all,1
5641,flooding,Albania,flash flooding madison valleywx,1
5642,flooding,,soon start flooding comment section come brazil comments bc,0
5644,flooding,Brunei Darussalam,last year just lot the drums flooding janice falling,0
5645,flooding,Cameroon,burst water main causes major flooding birmingham hospital omg,1
5646,flooding,,heavy rainfall flooding northern vietnam situation report no,1
5647,flooding,,oh god memories flooding back,0
5650,flooding,,flood disaster burst water pipe floods apartments nycha senior center ny nyburst water pipe floods a,1
5651,flooding,,lrt look tom feels flooding back,0
5652,flooding,,myanmar msf assisting thousands worst flooding decades hits parts myanmar,1
5653,flooding,British Indian Ocean Territory,residents central part ocean city heard engineers flood mitigation options tuesday ocnj,1
5654,flooding,,wen finally get girl flooding yall wit pics rs tho,0
5655,flooding,,flooding mad decent,0
5656,flooding,Malaysia,monsoon flooding kills dozens myanmar prompting calls help,1
5657,flooding,,memorial unveiled travis county deputy killed sept flooding travis county sheriff greg hamilton,1
5658,flooding,,flooding kills displace million pakistan least people killed nearly,1
5659,flooding,India,thankkk u soo flooding notificationsu fella parsholics r superb jus soo awesomelove love u always frvrgrateful,0
5661,floods,Cameroon,slip sliding away flash floods info writers wtony nester writingtips,1
5662,floods,,bringing tornadoes floods bringing climate change god america plaguing farrakhan quote,1
5663,floods,,myanmar flooding heavy monsoon rains month july caused flooding flash floods landsli,1
5664,floods,Australia,india people taken shelter relief camps government set up floods,1
5665,floods,,worry sure climate nothing hail floods tornados alberta ontario sure gods just mad you,1
5668,floods,,never thought wtf moment yet months degree heat next flash floods,1
5669,floods,,granted like half town floods rains still whatever,1
5670,floods,Australia,rspca site multiple story high rise buildings next low density character residential area floods,0
5671,floods,Canada,hope mountain dew erodes throat floods lungs leaving drown death,1
5672,floods,United States,disaster group stunned floods,1
5673,floods,United Kingdom,theres person reckon dying brain floods dmt causing relive life real time simulation,0
5674,floods,,ever remembered old song something havent heared years words carry floods memories along priceless,0
5675,floods,United States,floods fishing finally sunshine fab deals albertsons anniversary sale lauren paints beautiful life,0
5676,floods,,flood disaster bengal floods cm mamata banerjee blames dvc bjp claims state failed economic t,1
5677,floods,,dead due floods myanmar naypyidaw aug prensa latina death toll rose today myanmar,1
5680,floods,,typhoon soudelor approaches killed missing floods philippines via,1
5683,floods,New Caledonia,rains nj flash floods otherwise just desert grief taxes,1
5684,floods,New Caledonia,download itunes floods glory luiz santos jazz art music,0
5685,floods,Uganda,yep floods clyde dam releasing every bit water could speccy ev charging way,1
5686,floods,Cameroon,bamenda floods kill animals birds,1
5687,floods,Sao Tome and Principe,hope rains throughout whole weekend hope floods portaloos become sentient,0
5688,floods,Nigeria,apc chieftain tasks dickson nb floods donation bayelsa,1
5689,floods,Philippines,pagasa am yellow warning panay island guimaras negros possible floods lowlying areas landslides mountainous areas,1
5690,floods,,rt hourfamine bangladesh government declared floods emergency worldvision continue,1
5692,floods,Cameroon,nearly thousand people affected floods paraguay,1
5693,floods,,etp bengal floods cm mamata banerjee blames dvc bjp claims state failed relief funds even flood w,1
5694,floods,,allah help suffering pakistan floods families dua,1
5695,floods,,children myanmar face double catastrophe floods hit,1
5698,floods,New Caledonia,love drake floods instagram makes feel real tune everything like sumn,0
5699,floods,,bringing tornadoes floods bringing climate change god america plaguing farrakhan quote,0
5703,floods,,die myanmar floods affected,1
5704,floods,,typhoon soudelor approaches killed missing floods typhoon,1
5705,floods,,memphis always floods,1
5706,floods,,floods cause damage death asia media content,1
5707,floods,Brazil,as soon maintenance ends everyone floods servers servers destroyed extreme load maintenance starts anew,0
5710,floods,,bringing tornadoes floods bringing climate change god america plaguing farrakhan quote,0
5711,forest%20fire,,e particulatebreak up solid combust fossil fuel voltaic active forest fire biological vocpetroleum ch bacteria decomposition,1
5712,forest%20fire,,careful anyone lives west beaverton forest grove rapidly spreading fire heading east,1
5713,forest%20fire,Kenya,added video playlist ori bind forest ep fire death,1
5714,forest%20fire,,careless match start forest fire takes whole box start campfire,1
5715,forest%20fire,Portugal,little forest fire wardens,1
5716,forest%20fire,New Caledonia,fire pisgah national forest grows acres,1
5717,forest%20fire,United States,ashenforest floorburnt manzanita timber johnson fire ridge forest road routecomplex,1
5719,forest%20fire,,runs setting forest fire bites shit neck,1
5720,forest%20fire,,sets forest fire,1
5721,forest%20fire,,liked video j cole fire squad forest hills drive,0
5722,forest%20fire,United States,view smoke column rising south end blake fire forest road routecomplex,1
5724,forest%20fire,,starts forest fire put out,1
5726,forest%20fire,New Caledonia,fire pisgah national forest grows acres,1
5727,forest%20fire,,grill school function grills going pretty off forest fire inbetween made work,0
5729,forest%20fire,,p watch forest fire smoke lifted nuff fme tmake run tthe pet store hwy n bhome p,1
5730,forest%20fire,Chile,forest fires socal fire watch realhiphop,1
5732,forest%20fire,,us forest service firefighter david ruhl died frog fire modoc national forest temporarily reassigned,1
5733,forest%20fire,Ghana,usfs acronym united states fire service,0
5734,forest%20fire,,careless match start forest fire takes whole box start campfire,0
