id,keyword,location,text,target
7929,rainstorm,,major rainstorm happening gonna lie down drift away storming around little while bebacksoon,1
7930,rainstorm,,landslide italian alps kills three rome reuters three people killed severe rainstorm i,1
7932,rainstorm,Tunisia,roar waves rainstorm,0
7933,rainstorm,,robotrainstorm two vacancies castle fantasy football team join us fun,0
7934,rainstorm,,look like got caught rainstorm amazing disgusting same time,0
7935,rainstorm,,rainstorm update further north further south,1
7936,rainstorm,Thailand,nigeria rainstorm destroys houses yobe state daily trust damaturu over,1
7937,rainstorm,,landslide italian alps kills three rome reuters three people killed severe rainstorm th,1
7938,rainstorm,United States,rain rain go away soaker way,0
7939,rainstorm,United States,hardly,0
7940,rainstorm,Holy See (Vatican City State),tomorrows evening commute receives red light rainstorm impacting region push way late evening,1
7941,rainstorm,Tunisia,rainstorm last nearly long enough,1
7943,rainstorm,,imsort interested fonts theyre using,0
7944,rainstorm,British Indian Ocean Territory,lizzie drove thru deep water flash floodrainstorm repair cost yrs later people still thnk cars float,1
7945,rainstorm,Cameroon,best believe wrong decisions made memphis streets rainstorm lol folk doe,0
7949,rainstorm,United Kingdom,rainstorm please,0
7950,rainstorm,Portugal,waking up sick rainstorm outside usually make sad today though put kooks stereo this,0
7952,rainstorm,Cameroon,yay feel wind gearing up rainstorm vancouver bring drought deadgrassandflowers wildfires,1
7953,rainstorm,,huge football fan know never fantasy leagues patience newbie,0
7954,rainstorm,Cayman Islands,the way move like full rainstorm house cards,1
7955,rainstorm,Portugal,rainstorm destroys houses yobe state,1
7957,rainstorm,,way move like full rainstorm house cards,0
7958,rainstorm,Uganda,landslide caused severe rainstorm kills italianåêalps,1
7959,razed,,former freedom surfspa razed make way new homes,0
7960,razed,,latest homes razed northern california wildfire abc news,1
7962,razed,Nigeria,tension abia inec governor ikpeazu pdp apga react,1
7963,razed,Serbia,latest homes razed northern california wildfire latest wildfires burning california,1
7965,razed,,latest homes razed northern california wildfire,1
7968,razed,,latest homes razed northern california wildfire abc news,1
7969,razed,,latest homes razed northern california wildfire abc news,1
7970,razed,,latest homes razed northern california wildfire lynchburg news advance,1
7971,razed,,news latest homes razed northern california wildfire new york times tafs fb,1
7972,razed,,latest homes razed northern california wildfire abc news,1
7973,razed,,latest homes razed northern california wildfire abc news,1
7976,razed,,latest homes razed northern california wildfire,1
7977,razed,,latest homes razed northern california wildfire,1
7978,razed,,latest homes razed northern california wildfire,1
7980,razed,Cameroon,significant think iconic pic church maybe ruins less substantial efforts razed,0
7981,razed,,latest homes razed northern california wildfire,1
7982,razed,,latest homes razed northern california wildfire,1
7983,razed,,latest homes razed northern california wildfire abc news,1
7984,razed,United Kingdom,least sincere,1
7987,razed,,latest homes razed northern california wildfire abc news,1
7988,razed,,latest homes razed northern california wildfire abc news,1
7989,razed,,latest homes razed northern california wildfire,1
7990,razed,Dominican Republic,homes razed northern calif wildfire sandiego,1
7991,razed,,george njenga hero saved burning friend razing wildfire,1
7992,razed,Suriname,today another dualcom enjoyed yesterdays check todays pm easter,0
7994,razed,,latest homes razed northern california wildfire abc news gn,1
7996,razed,,latest homes razed northern california wildfire abc news,1
7999,razed,,latest homes razed northern california wildfire abc news,1
8000,razed,,latest homes razed northern california wildfire abc news,1
8001,razed,,latest homes razed northerncalifornia wildfire zippednews,1
8002,razed,,latest homes razed northern california wildfire,1
8003,razed,,george njenga hero saved burning friend razing wildfire,1
8005,razed,,latest homes razed northern california wildfire,1
8006,razed,,latest homes razed northern california wildfire abc news,1
8008,razed,United States,vassalboro house razed make way public gazebo reports,0
8009,refugees,,justmarried turkish couple gave syrian refugees incredible gift fed family friends,1
8010,refugees,Andorra,police monitoring jihadis poland via,1
8012,refugees,Philippines,turkish newlyweds donate wedding money beautiful gesture still faith humanity,0
8013,refugees,Türkiye,justmarried turkish couple gave syrian refugees incredible gift washingtonpost,1
8015,refugees,Bulgaria,repulsive refugeesvictimiserdutton evangelicalliarabbott co lnp dupe press overdrive choppergatebronwynbishopauspol,0
8016,refugees,,retweet cameroon repatriating nigerian refugees due boko haram,1
8017,refugees,United States,newlyweds feed syrian refugees wedding cbc news latest canada world entertainment business news,0
8018,refugees,,wowo nigerian refugees repatriated cameroon,1
8019,refugees,,hmm nigerian refugees repatriated cameroon,1
8020,refugees,,whao nigerian refugees repatriated cameroon,1
8021,refugees,Sao Tome and Principe,imagine entire aisle dedicated making people look like serbian refugees director whole foods clothing section,0
8023,refugees,,couple spend wedding day feeding syrian refugees,0
8024,refugees,,reaad plsss nigerian refugees repatriated cameroon,1
8025,refugees,Spain,top story couple spend wedding day feeding syrian,0
8026,refugees,,refugee connections indiegogo campaign going live tomorrow support help launch online community refugees,1
8028,refugees,,yall read nigerian refugees repatriated cameroon,1
8029,refugees,,short throwing overboard think leader worse refugees worst pm ever,1
8030,refugees,United Kingdom,cameroon repatriated nigerian refugees,1
8031,refugees,Australia,captain abbott go down lnp boat refugees christianvalues,0
8032,refugees,,turkish couple spent wedding day feeding syrian refugees turkish couple got marrie,0
8034,refugees,,couple drones save refugees worlds deadliest border,1
8035,refugees,,whao nigerian refugees repatriated cameroon,1
8036,refugees,,hmm nigerian refugees repatriated cameroon,1
8037,refugees,India,turkish couple decided feed syrian refugees part wedding celebrations,0
8038,refugees,,right now even two years still refugees camped just south redcliffe village aidan,1
8039,refugees,Australia,newlyweds feed thousands syrian refugees hosting banquet wedding dinner age news,0
8040,refugees,,photos young refugees forced flee burundis violence vice news,1
8043,refugees,,thank helping many people need world,0
8044,refugees,,wowo nigerian refugees repatriated cameroon,0
8045,refugees,,newlyweds feed thousands syrian refugees hosting banquet wedding dinner via,1
8047,refugees,New Zealand,pacic media centre articles australia rsf protests new security gag reporting on,0
8049,refugees,,recap nigerian refugees repatriated cameroon,1
8055,refugees,United States,generous bride earth couple feeds syrian refugees wedding day via love it,0
8056,refugees,,whao nigerian refugees repatriated cameroon,1
8057,refugees,Australia,returned refugees fleeing vietnamese govt treat returned dutton presser,1
8058,refugees,Switzerland,chpsre rt refugees followers paris visit a dream humanity exhibition rezaphotography,1
8060,rescue,Trinidad and Tobago,policyholders object clico rescue plan,1
8061,rescue,Tunisia,panik kelbytomlinson rescue,0
8062,rescue,,coastal german shepherd rescue oc shared link animalrescue,0
8064,rescue,Canada,ud rescue structural collapse scott road ypres road york trucks,1
8065,rescue,New Caledonia,rescue day world cat day saturday aug th black blackwhite cats just newbeginningsanimalrescue,0
8066,rescue,Bangladesh,blood pressure meds still probably roof long ppact story broke involved animal rescue,0
8067,rescue,United Kingdom,coastal german shepherd rescue oc shared link animalrescue,0
8068,rescue,,coastal german shepherd rescue oc shared link ecstatic rescued racco animalrescue,0
8069,rescue,,suggs vivian rescue psychrewatch,0
8070,rescue,,lengths rescue cat need,0
8071,rescue,United Kingdom,last chance animal rescue new posts animalrescue,0
8073,rescue,,last chance animal rescue new posts animalrescue,0
8074,rescue,,sammy todd always rescue uniform still rescue lmao forever kfc fam,0
8079,rescue,United States,lunch crew made night night long day peaceloverescue,0
8081,rescue,United States,tell united nations plantations forests via,0
8083,rescue,,mary coming troy rescue,0
8084,rescue,Canada,ud rescue structural collapse scott road ypres road york trucks,1
8085,rescue,,floodzone general raheel sharif visits chitral lauded efforts fwo army troops army aviation rescue opera,1
8087,rescue,,last chance animal rescue new posts animalrescue,0
8088,rescue,,many dogs rescue dogs,0
8089,rescue,India,officials rescue migrants off libya bodies found fox news news,1
8091,rescue,United States,coastal german shepherd rescue oc shared link animalrescue,0
8094,rescued,United States,sabrina dad rescued dude kept cage,1
8095,rescued,,britons rescued amid himalaya floods,1
8096,rescued,Nigeria,kidnapped ladies rescued police enugu nigerian tribune,1
8097,rescued,Indonesia,rescued med migrants arrive sicily,1
8098,rescued,United States,hand glass water sit down i rescued tenno lived ship around dojo year,0
8100,rescued,,trust get rescued dopey ones val hilarious shame shes probably going die emmerdale,0
8101,rescued,Cameroon,summer summervibes california puppy pitmix rescued brixton banksy happy mybabies,0
8102,rescued,United Kingdom,man buried dog alive thought find rescued just time,0
8103,rescued,Canada,monthold baby girl rescued coastguard floated half mile sea socialnews,1
8105,rescued,Eritrea,skyrim awaits rescuedagain,0
8106,rescued,United States,rescued med migrants arrive sicily,1
8109,rescued,United Kingdom,finnish hip hop pioneer paleface rescued drifting raft brought container later enkelbiljett menolippu,0
8110,rescued,India,bovines rescued smugglersåênabbed,1
8111,rescued,,funds needed rescued abandoned cocker spaniels,0
8112,rescued,,liked video romanatwoodvlogs rescued sick kittens,0
8113,rescued,,news britons rescued amid himalaya floods,1
8116,rescued,Botswana,brave little dog gets rescued river recovery inspi via,0
8118,rescued,United States,homeless man traveling usa stray dogs rescued gets helping hand strangers via,0
8119,rescued,,breaking news tonight kids rescued play room week food water parents sex life haha,1
8120,rescued,New Caledonia,you rescued actually pretend are giorgio hiatt,0
8121,rescued,Israel,rescued dog least years ago shes old still sweet ever,0
8122,rescued,Nigeria,rescued med migrants arrive sicily hundreds migrants,1
8125,rescued,Eritrea,why werent taken back africa once rescued cnews,1
8126,rescued,,migrants rescued boat capsizes off libya,1
8128,rescued,,young children among rescued capsized boat off libya via,1
8129,rescued,,heroes springer spaniel dog dad rescued stranded baby dolphin,1
8130,rescued,United Kingdom,trust get rescued dopey ones emmerdale summerfate,0
8131,rescued,Ireland,three beached whales rescued kerry,1
8133,rescued,,rescued tb goes ribbon hits via,0
8135,rescued,,turn back me rescued swept away sins though clouds isaiah contemporary english version,0
8136,rescued,United States,pets r like part family love animals last pets rescued breaks heart animals mistreated,0
8137,rescued,Morocco,liked video homeless dog living cardboard box gets rescued heartwarming,0
8138,rescued,Canada,angry mistrustful rescued elephant finds peace friendship new home photos via,0
8140,rescued,,photo hundreds rescued migrants await disembarkment irish naval vessel palermo italy,1
8141,rescued,Luxembourg,rescued med migrants arrive sicily,1
8142,rescuers,Nigeria,video were picking up bodies water rescuers searching hundreds migrants africa news,1
8143,rescuers,,video were picking up bodies water rescuers searching hundreds migrants mediterran,1
8144,rescuers,Malaysia,video were picking up bodies water rescuers searching hundreds migrants mediterran,1
8146,rescuers,,video were picking up bodies water rescuers searching hundreds migrants mediterran,1
8147,rescuers,,video were picking up bodies water rescuers searching hundreds migrants mediterranean,1
8149,rescuers,,world fears missing migrants med rescuers search survivors boat carrying many a news,1
8150,rescuers,South Africa,rescuers searching hundreds migrants mediterranean boat carr,1
8154,rescuers,,unexplainable desire watch rescuers childhooddefined,0
8155,rescuers,Nigeria,roddypiperautos fears missing migrants med rescuers search survivors boat carrying ma,1
8156,rescuers,United Kingdom,channel same rspca dog rescuersthe infomercial crept back door,0
8158,rescuers,,video were picking up bodies water rescuers searching hundreds migrants mediterranean boat carryi,1
8159,rescuers,,gps app guides rescuers injured biker marin county,1
8161,rescuers,,video were picking up bodies water rescuers searching hundreds migrants mediterran,1
8162,rescuers,United Kingdom,video were picking up bodies water rescuers searching hundreds migrants mediterran,1
8163,rescuers,,video were picking up bodies water rescuers searching hundreds migrants mediterranean boat carryi,1
8164,rescuers,,video were picking up bodies water rescuers searching hundreds migrants africa news,1
8165,rescuers,,last second ebay bid rt shaolin rescuers dvd shen chan nan chiang five venoms kung fu please favori,0
8168,rescuers,,video were picking up bodies water rescuers searching hundreds migrants mediterranean boat carryi,1
8169,rescuers,,worldnews video were picking up bodies water bbc news home rescuers searching hundreds of,1
8170,rescuers,Thailand,video were picking up bodies water rescuers searching hundreds migrants mediterran,1
8171,rescuers,,video were picking up bodies water rescuers searching,1
8172,rescuers,Thailand,ahmazing story power animal rescuers have starving homeless dog future rescued person,1
8175,rescuers,,rescuers searching hundreds migrants mediterranean boat carrying many people capsized off coast,1
8176,rescuers,United States,news many deaths shipwreck rescuers trying save hundreds migrants the via,1
8177,rescuers,United States,video were picking up bodies water rescuers searching hundreds migrants mediterran,1
8180,rescuers,,video were picking up bodies water rescuers searching hundreds migrants mediterran,1
8181,rescuers,Kiribati,rescuers found barely alive idea allergic this,1
8182,rescuers,,fears missing migrants med rescuers search survivors boat carrying many migrant,1
8183,rescuers,,video were picking up bodies water rescuers searching hundreds migrants mediterranean boat carryi,1
8184,rescuers,,womans gps app guides rescuers injured biker marin county sfgate,1
8187,rescuers,,fears missing migrants med rescuers search survivors boat carrying many,1
8188,rescuers,,rescuers find survivors nepal earthquake buried,1
8189,rescuers,France,rescuers recover body yearold calgary man lake near vulcan,1
8190,rescuers,,fears missing migrants med rescuers search survivors boat carrying many,1
8191,rescuers,Costa Rica,video were picking up bodies water rescuers searching hundreds migrants the bbc news,1
8195,riot,,meatloving feminists world riot grill arrived pop quiz prefer fem art,0
8196,riot,India,stuart broad takes eight joe root runs riot against aussies,0
8201,riot,United Kingdom,predict riot,1
8202,riot,,discovered listenbuy riot blowmandyup,0
8203,riot,,meatloving feminists world riot grill arrived arts,0
8204,riot,,rascal flatts riot tour atlantic city beach concertaugust tickets,0
8205,riot,,meatloving feminists world riot grill hasåêarrived,0
8208,riot,Sweden,seriously tactical riot against headquarters disney marvel,0
8209,riot,Cameroon,keep eye looking lots new team members coming daysweeks,0
8210,riot,Philippines,meatloving feminists world riot grill arrived pop quiz prefer feminist,0
8211,riot,,selfie booth riot kappa,1
8212,riot,,start big ass riot send jail today mfs shidddd,0
8213,riot,,riot kit bah part new concept gear coming autumnwinter menswear fashion,0
8214,riot,,discovered listenbuy riot blowmandyup,0
8215,riot,,liked video thorins thoughts riot sandbox mode lol,0
8216,riot,,stuart broad takes eight joe root runs riot against aussies stuart broad took careerbest figures,0
8217,riot,Chile,retweeted sarah silverman soundtrack walk starts w tracey ullman know perfect,0
8218,riot,,meatloving feminists world riot grill arrived,1
8219,riot,,time riot really make official satan teemo skin,0
8221,riot,Bulgaria,liked video sick riot shield slide spots,0
8223,riot,United States,torrecilla always info secret lol game check secret get riot points bio,0
8224,riot,Cayman Islands,transwomen drag queens color lead riot well known butch lesbian usually credited inciting it,0
8225,riot,Chile,preorder film itunes watch yay,0
8226,riot,United States,without ally near skill get hired really cause making every riot staff member look incompetent,0
8231,riot,India,pop quiz prefer feminist revolution fried ravioliåêwith porcini,0
8232,riot,,meatloving feminists world riot grill arrived oliviamiles,0
8234,riot,Ireland,except know started riot even makes sense credit particular individuals,1
8235,riot,Chile,juan carlos salvador secret tips get riot points lol now check secret bio,0
8236,riot,,southeast dirt riot series crowns champions southeast dirt riot series crowns championsblackfoot id so,0
8237,riot,Ireland,sweetpeas running riot allotment brightening up rainy day,1
8238,riot,,stuart broad takes eight joe root runs riot against aussies,0
8239,riot,Angola,riot police intervene southampton vitesse arnhem supporters clash fans clash buildup second,1
8240,riot,,discovered listenbuy riot blowmandyup,0
8241,riot,Dominican Republic,cracker white riot nowplaying,0
8242,rioting,United Kingdom,government care police stop rioting eventually protestors eventually skyscrapers become plantcovered,1
8243,rioting,Ireland,new doco tonight pm setanta sports ireland freeview largest police presence soccer game ireland stop prevent rioting,0
8244,rioting,,eric clapton shot sheriff guess many people rioting right none,1
8245,rioting,Uganda,kill off val rioting emmerdale,0
8246,rioting,Belarus,money buy happiness just lie tell poor people keep rioting,1
8247,rioting,,bloody hell already upgraded rioting hyperbole saintsfc,1
8250,rioting,Australia,twitter count down rioting financial collapse brazil rio,1
8251,rioting,,black dude antioch rioting,0
8252,rioting,,recently met discuss race relations america benefits rioting loveislove,0
8253,rioting,Gabon,people like charged inevitable rioting contributing lies,0
8254,rioting,Cabo Verde,cindy noonanheartbreak baltimore rioting yahistorical undergroundrailraod,1
8256,rioting,,leeds fan rioting embra lower tier league cup final dee dum,1
8257,rioting,,still rioting couple hours left up class,1
8258,rioting,United States,plenty black people rioting tosu won championship well,0
8259,rioting,India,ferguson riots worked next time say rioting change anything fixed you,1
8261,rioting,United Kingdom,bbcnews ass british insurers rioting cost insurers millions police numbers reduced blind fat contr,1
8262,rioting,Trinidad and Tobago,bhramabull watch run jewels facts defend rioting ferguson socially minded duo takes the,1
8264,rioting,New Caledonia,think twitter invented keep insomniacs rioting wee small hours,0
8266,rioting,,people rioting justice served murderer behind bars simple justiceno peace justicepeace,1
8267,rioting,,still rioting gmail,0
8270,rioting,United Kingdom,rioting,1
8271,rioting,,get money tomorrow rioting,0
8274,rioting,,rt why sweden venezuela few days rioting venezuela riots directed,1
8276,rioting,,rioting happy valley penn state loses,0
8278,rioting,,group mascara smeared girls rioting horrific think,1
8279,rioting,,last time high profile name due signing nffc city rioting wesley verhoek household name dontpanic,1
8280,rioting,Bulgaria,alternatives legal alternatives protesting rioting peaceful thing demonstration,0
8283,rioting,Holy See (Vatican City State),sick criminals parents friends rioting killed police give damn officer is,1
8284,rioting,,rioting began prior decision indictment really making sense,1
8285,rioting,India,ashes test match currently interesting stupid congress rioting,1
8286,rioting,Eritrea,people rioting everywhere think them usamisan,1
8287,rioting,,football hooligan jailed rioting game scotland already banned matches england uknews,1
8288,rioting,United States,cindy noonanheartbreak baltimore rioting yahistorical undergroundrailraod,0
8289,rioting,United Kingdom,bbcnews ass british insurers rioting cost insurersmillions police numbers reduced blind fat controllers,1
8291,rioting,United States,lived family lived countries looters shot sight rioting tolerated why,1
8292,rubble,Georgia,refuse let life reduced rubble shit keeps piling up get shovel,0
8294,rubble,Nigeria,chinas stock market crash gems rubble stock market crash su via,0
8295,rubble,,if go nuclear arms race going make rubble bounce winston churchill,0
8296,rubble,,stock market crash summer sparked interest bargain hunt å,1
8297,rubble,,stock market crash summer sparked interest bargain hunt å,0
8298,rubble,,parents impulsive sometimes remember coming home room filled dust rubble just wanted redesigned,0
8300,rubble,,turning rubble disasters lego bricks build houses with belongs crazyideascollege,0
8301,rubble,,wisenews chinas stock market crash gems rubble,0
8304,rubble,,forbes chinas stock market crash gems rubble stock market crash summer ha,0
8309,rubble,,forbes europe chinas stock market crash gems rubble,1
8310,rubble,,stock market crash summer sparked interest bargain hunters bulls betting rebound,0
8311,rubble,Kiribati,again say was referring main buildings hit rubble,1
8312,rubble,Italy,chinas stock market crash gems rubble,0
8314,rubble,United Kingdom,wisenews chinas stock market crash gems rubble,1
8315,rubble,,jun yemenis search survivors rubble houses old city following an,1
8317,rubble,United Kingdom,chinas stock market crash gems rubble forbesasia,1
8318,rubble,Sao Tome and Principe,steve buscemi firefightr b fame workd hr shifts diggin thru wtc rubble lookg survivors,1
8320,rubble,United States,chinas stock market crash gems rubble tcot p news,0
8321,rubble,Spain,chinas stock market crash gems rubble stock market crash summer h forbes,0
8324,rubble,United Kingdom,found diamond rubble,0
8329,rubble,Cameroon,tnn chinas stock market crash gems rubble,1
8330,rubble,Cabo Verde,chinas stock market crash gems rubble roimentor yycwalks,1
8332,rubble,United States,chinas stock market crash gems rubble,0
8334,rubble,Portugal,wisenews chinas stock market crash gems rubble,1
8335,rubble,Jamaica,new post chinas stock market crash gems rubble,0
8337,rubble,,chinas stock market crash gems rubble stock market crash summer sparked,0
8339,rubble,,photo postapocalypticflimflam prodding around rubble,0
8341,rubble,Georgia,wisenews chinas stock market crash gems rubble,0
8344,ruin,Canada,damn suh let ruin year bruh year better start carpooling like back day,0
8345,ruin,Tunisia,ruin mood lost direction,0
8346,ruin,,ruin everything,0
8347,ruin,,quote never let problems ruin faith,0
8348,ruin,United Kingdom,anxious though many ppl watching meet makes uncomfortable let ruin moment,0
8349,ruin,United States,smokers ruin new car smell,0
8350,ruin,Iceland,just wait friends mta ruin sorrybutitstrue,0
8351,ruin,,really sad red closing yuppies n tourists ruin everything,0
8352,ruin,,always gotta ruin mood,0
8355,ruin,,understand wanting hang guy friends give space ruin trust you,0
8356,ruin,,like why earth anybody unhappy purposely ruin somebody elses happiness,0
8360,ruin,Malaysia,fresh da shower lookss still loving new hair ruin brand yes,0
8361,ruin,,tryna ruin life,0
8362,ruin,United Kingdom,well me everyone applaud terrific never ruin anything,0
8363,ruin,,four things ruin personal injury accident claim,1
8364,ruin,,ruin holidays wordk its zmne,0
8365,ruin,Peru,every time really good day someone just ruin,0
8366,ruin,Bahamas,wanna ruin relationship just ask what intentions,0
8367,ruin,United Kingdom,go ruin something awful minions,0
8368,ruin,,really awful even work make up artist ruin things,0
8369,ruin,New Caledonia,damn wale knows ruin song,0
8370,ruin,,cause play like symphony play till fingers bleed greatest masterpiece ruin me,0
8371,ruin,,why family ruin something actually going good me,0
8372,ruin,Zimbabwe,hate awkward ruin things,0
8374,ruin,,long road ruin foo fighters,0
8375,ruin,Canada,why u ruin everything u ruined sour cream u put brick cheese freezerdummy,0
8377,ruin,,let few assholes ruin night,0
8378,ruin,,lol real issue way nfl trying ruin guys legacy,0
8382,ruin,United States,rt ruin s day,0
8383,ruin,Canada,greedy bastards way ruin creativity censorship youtube,0
8385,ruin,,shouldnt gonna ruin game vanessa great player,0
8386,ruin,,yes yes will wanna ruin life lol,0
8387,ruin,,wanna reboot fresh prince belair bring back original cast everything nothing ruin show,0
8388,ruin,,make yourself happy fuck tryna ruin keep smiling,0
8389,ruin,Canada,few people let ruin life soul cervix everything odell definitely top list,0
8390,ruin,Rwanda,ruin life to,0
8391,ruin,,babe gonna ruin let stay,0
8392,sandstorm,Morocco,everything ok shes listening sandstorm now,0
8393,sandstorm,United States,watch airport get swallowed up sandstorm minute,1
8394,sandstorm,,watch airport get swallowed up sandstorm minute,1
8396,sandstorm,United States,wouldnt turn sandstorm riot gave good answer gave dumb excuses least new client,0
8397,sandstorm,,watch airport get swallowed up sandstorm minute,1
